Título,Precio
"Tarjeta Gráfica De Escritorio Rx580 De 8 Gb, Ddr5, 256 Bits,",$980.448
"Tarjeta Gráfica Gtx550ti 6gb Gpu 192 Bits, Compatible Con Vi",$534.241
Tarjeta de video Nvidia Gigabyte  Aero GeForce RTX 40 Series RTX 4060 8 GB GV-N4060AERO OC-8GD OC Edition 8GB,$1.697.90021% OFF
Tarjeta de video Nvidia Gigabyte  GeForce 700 Series GT 710 GV-N710D3-2GL (REV 2.0) 2GB,$255.5505% OFF
Tarjeta De Video Gigabyte GT 1030 Low Profile D4 2G,$348.158
Placa De Video Gigabyte Rtx 3050 Windforce Oc 6gb Nvidia 3c,$949.90038% OFF
Tarjeta Gráfica Para Computadora Gddr5 Rx580 Game 8 Gb 256 B,$477.711
Tarjeta De Video Gráfica Nvidia Quadro K1200 4gb,$720.000
Tarjeta Grafica Gigabyte Nvidia Geforce Gt 710 2 Gb,$295.000
Tarjeta de video AMD ASRock  Phantom Gaming Radeon RX 500 Series RX 550 PHANTOM G R RX550 2G 2GB,$413.000
Tarjetas Gráficas Rx580 8gb Ddr5 Gpu Pc Gaming Juego De Escr,$479.219
"Tarjetas Gráficas Rx 550 De 4 Gb, Tarjetas Gráficas Gpu Gddr",$345.126
"Tarjeta Gráfica Gddr5 Rx 580 De 8 Gb Y 256 Bits, Compatible",$492.265
Tarjeta Gráfica Amd Hd6770 4gb Ddr5 128,$233.930
"Tarjeta Gráfica Gigabyte Geforce Rtx 4060 Gaming Oc , 8 Gb",$2.017.781
"Tarjeta Gráfica Gigabyte Geforce Gtx 1650, 4gb, 128-bit",$1.314.127
Tarjeta Gráfica Gigabyte Geforce Rtx 4060 Ti Gaming Oc 8gb,$2.652.437
Tarjeta Gráfica De Juego De Escritorio Rx580 8g Para Amd 8gb,$499.18710% OFF
Tarjeta Gráfica Gigabyte Aorus Geforce Rtx 3070 Ti Master 8g,$6.501.41410% OFF
Gráficos Para Juegos Powercolor Fighter Amd Radeon Rx 6500 X,$1.401.185
Tarjeta Gráfica Para Juegos Asus Phoenix Nvidia Geforce Rtx,$2.060.866
Tarjeta Gráfica Asus Geforce Rtx 3050 Lp Brk Oc 6gb Gddr6,$1.405.7119% OFF
Tarjeta Gráfica Nvidia Geforce Rtx 3090 Founders Edition 24g,$7.755.3739% OFF
Tarjeta Gráfica Nvidia Geforce Rtx 3080 Founders Edition,$5.175.5739% OFF
"Tarjeta Gráfica Asus Nvidia Geforce Gt 730, 2 Gb, Gddr5",$554.386
Tarjeta Gráfica Msi Geforce Gtx 1080 Ti Gaming X Trio 11gb,$4.760.2499% OFF
Tarjeta Gráfica Xfx Speedster Swft 210 Radeon Rx 6600 Core 8,$1.389.73710% OFF
"Tarjeta Gráfica Escritorio Rx580 8 Gb, Ddr5, 256 Bits,",$521.107
Tarjeta Gráfica Para Juegos Msi Geforce Rtx 3060 Ventus 3x 1,$2.839.3779% OFF
Tarjeta Gráfica Msi Gaming Geforce Rtx 3060 12gb Gdrr6,$2.183.112
Tarjeta Gráfica Asus Dual Geforce Rtx 4070 Super Evo Oc 12gb,$4.069.37410% OFF
Tarjeta Gráfica Gtx1660 Ti 6 Gb Gddr6 12 Nm 192 Bits 1500-17,$974.191
Tarjeta Gráfica Zotac Geforce Rtx 4060 Ti 8 Gb Twin Edge Oc,$2.715.889
Tarjeta Gráfica Peland Rtx 3060ti 8g,$2.440.160
Tarjeta Gráfica Gigabyte 16 Gb 256 Bit Gddr6 2525 Mhz,$5.735.683
Rx 580 8gb 256 Bits 2048sp Gddr5 Juego De Tarjetas Gráficas,$439.28410% OFF
Tarjeta Gráfica Msi Gaming Geforce Gt 1030 4gb Gdrr4 64-bit,$722.8239% OFF
"Tarjeta Gráfica Gigabyte Geforce Rtx 4060 Windforce Oc 8g,..",$1.980.775
W Tarjeta Gráfica Peladen Rx5500 Xt Para Amd Radeon 8gb S,$767.017
Tarjetas Gráficas Rtx 2060 Super 8gb Gddr6 256bit 12nm Para,$1.323.001
Tarjeta Gráfica Msi Gaming Geforce Gtx 1070 Ti 8gb Gdrr5,$3.386.48610% OFF
"Tarjeta Gráfica Gtx550ti 6gb Gpu 192 Bits, Compatible Con Vi",$332.968
Tarjeta Gráfica Para Juegos Gddr5 Para Gtx1060 6gb 192bit Du,$652.36031% OFF
Tarjeta Gráfica Msi Gaming Geforce Rtx 2080 Ti 11gb Gddr6,$7.272.1599% OFF
Tarjeta Gráfica Radeon Amd Graphics Rx580 Gaming Card Par,$441.414
Tarjeta Gráfica Msi Geforce Rtx 4070 Ti Super 16gb Gdrr6x,$6.340.787
Tarjeta Gráfica Msi Gaming Geforce Rtx 4060 Ti 16gb Gdrr6,$4.095.554
"Tarjeta Gráfica Jingsha Rx550 De 4 Gb/gddr5/128 Bits, Memori",$475.4039% OFF
Tarjeta Gráfica Rx580 8gb 2048sp Hd Game Tarjeta Gráfica Pci,$583.450
Tarjeta Gráfica Para Computadora De Escritorio Rx590 8gb Gdd,$534.729
